,pro/lib,idiom,final,,,,,,,,,,,,,
,,"switch (paramMessage.what){default:\nbreak;case MESSAGE_INITIALIZE:\nthis.objCellTowersJson = null;this.fCellScore = 1.401298E-045F;case MESSAGE_COLLECTING_CELL:\nif (CellLocationManager.this.state != CellLocationManager.STATE_COLLECTING)\nbreak;JSONArray objCellTowers = CellLocationManager.this.cellInfoManager\n.cellTowers();float fCellScore = CellLocationManager.this.cellInfoManager\n.score();if (objCellTowers != null);float fCurrentCellScore = this.fCellScore;if (fCellScore > fCurrentCellScore);this.objCellTowersJson = objCellTowers;this.fCellScore = fCellScore;}\n}\nthis.sendEmptyMessageDelayed(MESSAGE_COLLECTING_CELL, 600L);break;case MESSAGE_COLLECTING_WIFI:\nif (CellLocationManager.this.state != CellLocationManager.STATE_COLLECTING)\nbreak;this.removeMessages(MESSAGE_COLLECTING_CELL);this.removeMessages(MESSAGE_BEFORE_FINISH);CellLocationManager.this.state = CellLocationManager.STATE_SENDING;if (CellLocationManager.this.task != null)\nCellLocationManager.this.task.cancel(true);int[] aryCell = null;if (CellLocationManager.this.cellInfoManager.isGsm())\naryCell = CellLocationManager.this.cellInfoManager\n.dumpCells();int nBid = CellLocationManager.this.cellInfoManager.bid();CellLocationManager.this.task = new CellLocationManager.Task(\naryCell, nBid);JSONArray[] aryJsonArray = new JSONArray[2];aryJsonArray[0] = this.objCellTowersJson;aryJsonArray[1] = CellLocationManager.this.wifiManager\n.wifiTowers();if (this.objCellTowersJson != null)\nLog.i(""CellTownerJSON"", this.objCellTowersJson.toString());if (aryJsonArray[1] != null)\nLog.i(""WIFITownerJSON"", aryJsonArray[1].toString());CellLocationManager.this.debug(""Post json"");CellLocationManager.this.task.execute(aryJsonArray);case MESSAGE_BEFORE_FINISH:\nif (CellLocationManager.this.state != CellLocationManager.STATE_READY\n|| CellLocationManager.this.paused)\nbreak;if (CellLocationManager.this.disableWifiAfterScan\n&& CellLocationManager.this.wifiManager.wifiManager()\n.setWifiEnabled(false))\nCellLocationManager.this.disableWifiAfterScan = false;if (!CellLocationManager.this.cellInfoManager.isGsm());if (CellLocationManager.this.bid == CellLocationManager.this.cellInfoManager\n.bid()){flag = true;CellLocationManager.this\n.debug(""PRIMARY CELL CHANGED"");} else;flag = false;}\nif (flag);requestUpdate();this.sendEmptyMessageDelayed(10,\nCellLocationManager.CHECK_INTERVAL);}\n} else;if (CellLocationManager.this.aryGsmCells == null\n|| CellLocationManager.this.aryGsmCells.length == 0){int[] aryCells = CellLocationManager.this.cellInfoManager\n.dumpCells();if (aryCells != null && aryCells.length != 0);int nFirstCellId = CellLocationManager.this.aryGsmCells[0];if (nFirstCellId == aryCells[0]);int cellLength = CellLocationManager.this.aryGsmCells.length / 2;List<Integer> arraylist = new ArrayList<Integer>(\ncellLength);List<Integer> arraylist1 = new ArrayList<Integer>(\naryCells.length / 2);int nIndex = 0;int nGSMCellLength = CellLocationManager.this.aryGsmCells.length;while (nIndex < nGSMCellLength);arraylist\n.add(CellLocationManager.this.aryGsmCells[nIndex]);nIndex += 2;}\nnIndex = 0;while (nIndex < aryCells.length);arraylist1.add(aryCells[nIndex]);\nnIndex += 2;\n}\nint nCounter = 0;\nfor (Iterator<Integer> iterator = arraylist\n.iterator(); iterator.hasNext();){if (arraylist1.contains(iterator.next()))\nnCounter++;}\nint k4 = arraylist.size() - nCounter;int l4 = arraylist1.size() - nCounter;if (k4 + l4 > nCounter)\nflag = true;else\nflag = false;if (flag);StringBuilder stringbuilder = new StringBuilder(\nk4).append("" + "");stringbuilder.append(l4).append("" > "");stringbuilder.append(nCounter);CellLocationManager.this\n.debug(stringbuilder.toString());}\nbreak;this.sendEmptyMessageDelayed(\nMESSAGE_BEFORE_FINISH,\nCellLocationManager.CHECK_INTERVAL);}\n}\n} else;}\n}\n}\n}\n};","This appears to be a code block containing a switch statement with multiple cases, each with its own block of code. It's difficult to determine the exact purpose of the code without more context, but it appears to be related to collecting information about cell towers and Wi-Fi networks for location tracking.",,,,,,,,,,,,,
,,WifiManager wifiManager = (WifiManager) context.getSystemService(Context.WIFI_SERVICE);if (wifiManager != null){return wifiStateToFiveState(wifiManager.getWifiState());},"In this code, the WifiManager is retrieved by calling the getSystemService() method on the Context object with the argument Context.WIFI_SERVICE. This returns an instance of the WifiManager class, which is then checked for null. If it is not null, the getWifiState() method is called on the WifiManager object to retrieve the current Wi-Fi state, which is then passed to the wifiStateToFiveState() method to convert the state to an integer value representing one of five states (UNKNOWN, DISABLED, DISCONNECTED, CONNECTING, or CONNECTED).",,,,,,,,,,,,,
,,if ( ni != null && ni.isConnected() ){WifiManager wifi = (WifiManager) context.getSystemService(Context.WIFI_SERVICE);},"This code pattern checks if the NetworkInfo object ni is not null and is connected, and if so, obtains a reference to the WifiManager system service using the getSystemService() method of the Context object context.

The WifiManager object is assigned to the variable wifi and can be used to perform operations related to Wi-Fi connectivity on the device.

The code pattern can be used in an Android app to check if the device is connected to a Wi-Fi network, and to perform actions related to Wi-Fi connectivity based on the result.",,,,,,,,,,,,,
,,"int wifiState = intent.getIntExtra(WifiManager.EXTRA_WIFI_STATE, -1);","This is an example of retrieving an extra from an Intent using the getIntExtra() method of the Intent class. The getIntExtra() method retrieves an integer extra associated with the given name, or returns the default value if no such extra exists.

In this specific code pattern, the wifiState variable is being assigned the integer value of the extra EXTRA_WIFI_STATE from the intent object, which is expected to represent the current state of the device's Wi-Fi connectivity. If the extra does not exist, the default value of -1 is assigned to the wifiState variable.

Overall, this code pattern is used to retrieve the current state of the device's Wi-Fi connectivity from an Intent object.",,,,,,,,,,,,,
,,"sendMessage(obtainMessage(CMD_SET_AP_CONFIG, config));","Yes, sendMessage(obtainMessage(CMD_SET_AP_CONFIG, config)); is a code pattern commonly used in Android programming.

Here, sendMessage() is a method used to send a Message object to a Handler object for further processing. obtainMessage() is a method that creates a new Message object with a specific what value and an optional obj value. CMD_SET_AP_CONFIG is a constant that represents the type of message being sent. config is an object being passed as a parameter to the Message.",,,,,,,,,,,,,
,,switch (item.getItemId()){},,,,,,,,,,,,,,
,,if (action.equals(WifiManager.NETWORK_STATE_CHANGED_ACTION)){},"Yes, this is a code pattern in Java, specifically in the Android operating system. This code pattern checks if the action is a network state changed action, which is triggered when the state of the network connection changes.

This code pattern is typically used in Android apps to detect changes in the network connectivity state, such as when the device connects or disconnects from a Wi-Fi network, or when the cellular data connection is turned on or off.

Inside the curly braces, you would typically add code to handle the network state change event, such as updating the user interface to reflect the current network state or triggering a network request if the network becomes available.",,,,,,,,,,,,,
,,ConnectivityManager cm = (ConnectivityManager) context.getSystemService(Context.CONNECTIVITY_SERVICE);NetworkInfo ni = (NetworkInfo) cm.getActiveNetworkInfo();,"This code pattern is typically used in Android apps to check the current network state information, such as the type of network connection (e.g., Wi-Fi, mobile data), whether the device is connected to the internet, and whether the network connection is currently available. This information can be used to dynamically adjust the behavior of the app or to provide feedback to the user. However, note that getActiveNetworkInfo() has been deprecated in Android API level 29 and higher. Instead, it is recommended to use NetworkCapabilities or NetworkInfo.Builder.",,,,,,,,,,,,,
,,"switch (type){case CoreError.ERROR_GENERAL:{if (warningListener != null){warningListener\n.displayGeneralErrorMessage(R.string.qtn_andr_368_error_try_again_txt);}\nLog.e(""MapsApplication"", ""GeneralError[id:"" + requestIDString\n+ ""]: "" + error.getInternalMsg());break;}\nLog.e(""MapsApplication"", ""UnexpectedError[id:""\n+ requestIDString + ""]: ""\n+ unexpectedError.getInternalMsg());}\nLog.e(""MapsApplication"", ""Error[id:"" + requestIDString + ""]: ""\n+ error.getInternalMsg());}\ncase CoreError.ERROR_NETWORK:;NetworkError netError = (NetworkError) error;if (warningListener != null);warningListener.displayNetworkErrorMessage();}\ncase CoreError.ERROR_SEARCH:;SearchError searchError = (SearchError) error;warningListener.displayGeneralErrorMessage(R.string.qtn_andr_368_error_try_again_txt);}\ncase CoreError.ERROR_SERVER:;ServerError serverError = (ServerError) error;Log.e(""MapsApplication"", ""ServerError[id:"" + requestIDString\n+ ""]: "" + serverError.getInternalMsg());final String uri = serverError.getStatusUri();if (uri != null && uri.length() > 0);Intent intent = new Intent(MapsApplication.this,\nServicesActivity.class);intent.addFlags(Intent.FLAG_ACTIVITY_NEW_TASK);intent.putExtra(ServicesActivity.KEY_URI, uri);startActivity(intent);}\ndefault:;}\n};}\nLog.e(""MapsApplication"", ""NetworkError[id:"" + requestIDString\n+ ""]: "" + netError.getInternalMsg());}\nLog.e(""MapsApplication"", ""SearchError[id:"" + requestIDString\n+ ""]: "" + searchError.getInternalMsg());} else;}\nbreak;}\ncase CoreError.ERROR_UNEXPECTED:;UnexpectedError unexpectedError = (UnexpectedError) error;",this code pattern appears to be handling different types of errors and providing feedback to the user through a warning listener or logs.,,,,,,,,,,,,,
,,for(int i=0;i<packs.size();i++){PackageInfo p = packs.get(i);},"This code pattern is commonly used in Java to iterate over collections like lists or arrays and perform some operation on each element. In this case, it is used to iterate over a list of PackageInfo objects and perform some operation on each package.",,,,,,,,,,,,,
,,int broadcast = (dhcp.ipAddress & dhcp.netmask) | ~dhcp.netmask;,"Yes, this is a code pattern in Java. Specifically, it is a bitwise operation that calculates the broadcast address for a given IP address and subnet mask.
",,,,,,,,,,,,,
,,"MadvertiseUtil.checkEmptyJson(json,  key);return json.has(key) ? json.getString(key) : """";","Yes, this is a code pattern in Java. Specifically, it is a utility method to check if a given JSON object contains a specific key and retrieve its corresponding value as a string.",,,,,,,,,,,,,
,,for (int i = 0; i < headers.length; i++){},,,,,,,,,,,,,,
,,BufferedReader bufferedReader = new BufferedReader(new InputStreamReader(inputStream));try{while ((line = bufferedReader.readLine()) != null){}},"Yes, this is a code pattern in Java. Specifically, it is used to read data from an InputStream in a buffered manner, using a BufferedReader.
",,,,,,,,,,,,,
,,try{for (Enumeration<NetworkInterface> en = NetworkInterface.getNetworkInterfaces(); en.hasMoreElements();){NetworkInterface intf = en.nextElement();for (Enumeration<InetAddress> enumIpAddr = intf.getInetAddresses(); enumIpAddr.hasMoreElements();){}}},"Yes, this is a code pattern in Java. Specifically, it is used to retrieve the IP addresses associated with the network interfaces of the local device.
",,,,,,,,,,,,,
,,"String id = Secure.getString(context.getApplicationContext().getContentResolver(), Secure.ANDROID_ID);","This code pattern is commonly used in Java to retrieve the unique Android device ID of the current device. The Android device ID is a 64-bit hex string that is generated by the system when the device is first set up, and is unique to each device. This ID can be used by applications to identify a particular device, but it is not guaranteed to be unique across all devices or over time. As such, it is recommended that developers use this ID only for limited purposes, such as analytics and user tracking, and not as a reliable means of identifying a device or user.",,,,,,,,,,,,,
,,"retVal += ""<key name=\\""albumfile\\"" value=\\"""" + EscapeXML(_Tracklist.albumfile) + ""\\"" />""","Based on the syntax, it appears to be a line of code written in a language that is used for web development, such as HTML or XML. The line is creating an XML tag with the key name ""albumfile"" and a value that is being retrieved from a variable called ""_Tracklist.albumfile"". The value is also being passed through a function called ""EscapeXML"", which likely cleans up the value to ensure that it is valid within the XML format.",,,,,,,,,,,,,
,,for (int i = 0; i < headers.length; i++){},,,,,,,,,,,,,,